<res:Resenje xmlns="http://www.w3.org/ns/rdfa#" xmlns:res="http://resenje" xmlns:pred="http://www.xml.com/predicate/" xmlns:tipovi="http://tipovi" xmlns:xsi="http://www.w3.org/2001/XMLSchema-instance" about="http://resenje/b2fe25f8-abf3-4ea7-9727-1210afb795ba" broj_resenja="123" datum_resenja="2021-02-06" href="http://korisnik/igi.l.1999@gmail.com" id="http://resenje/b2fe25f8-abf3-4ea7-9727-1210afb795ba" rel="pred:vezanGradjanin" tip_odluke="основана" vocab="http://www.xml.com/predicate/" xsi:schemaLocation="http://resenje resenje.xsd">
   <res:Opis_zalbe razlog_zalbe="непоступање у законском року">Lorem Ipsum is simply <res:Ime_zalilac property="pred:zalilacIme">dummy text of the prin</res:Ime_zalilac>ting and typesetting<res:Prezime_zalilac property="pred:zalilacPrezime"> industry. Lorem Ip</res:Prezime_zalilac>sum has been the ind<res:Naziv_organa_vlasti property="pred:optuzeniNaziv">ustry's standard dumm</res:Naziv_organa_vlasti>y text ever sin<res:Mesto_organa_vlasti>ce the 1500s, when an un</res:Mesto_organa_vlasti>known printer too<res:Ulica_organa_vlasti>k a galley of type</res:Ulica_organa_vlasti>and scra<res:Ulicni_broj_organa_vlasti>mbled it to make a ty</res:Ulicni_broj_organa_vlasti>pe specimen book. It has survived not only five centuries, but also the leap into electronic typesetting, remaining essentially unchanged. It was popularised in the 1960s with the release of Letraset sheets containing Lorem Ipsum passages, and more recently with desktop publishing software like Aldus PageMaker including versions of Lorem Ipsum.</res:Opis_zalbe>
   <res:Odluka>
      <res:Nalog rok_izvrsenja="1">Lorem Ipsum is simply dummy text of the</res:Nalog>
      <res:Nalog rok_izvrsenja="1">printing and typesetting industry. Lorem Ipsum has been the industry's standard dummy text ever since the 1500s, when an unknown printer took a galley of type and scrambled it to make a type specimen book. It has survived not only five centuries, but also the leap into electronic typesetting, remaining essentially unchanged. It was popularised in the 1960s with the release of Letraset sheets containing Lorem Ipsum passages, and more recently with desktop publishing software like Aldus PageMaker including versions of Lorem Ipsum.</res:Nalog>
   </res:Odluka>
   <res:Obrazlozenje>
      <res:Postupak_zalioca>
         <res:Podnosenje_zalbe about="http://resenje/b2fe25f8-abf3-4ea7-9727-1210afb795ba" datum_zalbe="2021-02-06" href="http://zalbacutanje/3bb777af-0ace-4ca9-a73f-9921c089a1e4" rel="pred:vezanaZalba" vocab="http://www.xml.com/predicate/">Lorem Ipsum is simply dummy text of the printing and typesetting industry. Lorem Ipsum has been the industry's standard dummy text ever since the 1500s, when an unknown printer took a galley of type and scrambled it to make a type specimen book. It has survived not only five centuries, but also the leap into electronic typesetting, remaining essentially unchanged. It was popularised in the 1960s with the release of Letraset sheets containing Lorem Ipsum passages, and more recently with desktop publishing software like Aldus PageMaker including versions of Lorem Ipsum.</res:Podnosenje_zalbe>
         <res:Podnosenje_zahteva about="http://resenje/b2fe25f8-abf3-4ea7-9727-1210afb795ba" datum_zahteva="2020-02-04" href="http://zahtev/063e9af2-d409-4d3d-9340-1fb18f0eb124" rel="pred:vezanZahtev" vocab="http://www.xml.com/predicate/">Lorem Ipsum is simply dummy text of the printing and typesetting industry. Lorem Ipsum has been the industry's standard dummy text ever since the 1500s, when an unknown printer took a galley of type and scrambled it to make a type specimen book. It has survived not only five centuries, but also the leap into electronic typesetting, remaining essentially unchanged. It was popularised in the 1960s with the release of Letraset sheets containing Lorem Ipsum passages, and more recently with desktop publishing software like Aldus PageMaker including versions of Lorem Ipsum.</res:Podnosenje_zahteva>
      </res:Postupak_zalioca>
      <res:Prosledjivanje_zalbe datum_prosledjivanja="2021-02-06">Lorem Ipsum is simply dummy text of the printing and typesetting industry. Lorem Ipsum has been the industry's standard dummy text ever since the 1500s, when an unknown printer took a galley of type and scrambled it to make a type specimen book. It has survived not only five centuries, but also the leap into electronic typesetting, remaining essentially unchanged. It was popularised in the 1960s with the release of Letraset sheets containing Lorem Ipsum passages, and more recently with desktop publishing software like Aldus PageMaker including versions of Lorem Ipsum.</res:Prosledjivanje_zalbe>
      <res:Izjasnjenje_o_zalbi datum_izjasnjenja="2021-02-06">Lorem Ipsum is simply dummy text of the printing and typesetting industry. Lorem Ipsum has been the industry's standard dummy text ever since the 1500s, when an unknown printer took a galley of type and scrambled it to make a type specimen book. It has survived not only five centuries, but also the leap into electronic typesetting, remaining essentially unchanged. It was popularised in the 1960s with the release of Letraset sheets containing Lorem Ipsum passages, and more recently with desktop publishing software like Aldus PageMaker including versions of Lorem Ipsum.</res:Izjasnjenje_o_zalbi>
      <res:Razlozi_odluke>
         <res:Detaljan_opis_podnetog_zahteva>Lorem Ipsum is simply dummy text of the </res:Detaljan_opis_podnetog_zahteva>printing and typesetting industry. Lorem Ipsum has been the <res:Detaljan_opis_odgovora_na_zahtev>industry's standard dummy tex</res:Detaljan_opis_odgovora_na_zahtev>t ever since the 1500s, when an unknown printer took a galley of <res:Detaljan_opis_odluke>type and scrambled it to m</res:Detaljan_opis_odluke>ake a type specimen book. It has survived not only five centuries, but also the leap into electronic typesetting, remaining essentially unchanged. It was popularised in the 1960s with the release of Letraset sheets containing Lorem Ipsum passages, and more recently with desktop publishing software like Aldus PageMaker including versions of Lorem Ipsum.</res:Razlozi_odluke>
      <res:Zalba_na_resenje rok_za_tuzbu="30" sud="Управни суд у Београду" taksa_tuzbe="390.0" zakon="Закон о управним споровима">Lorem Ipsum is simply dummy text of the printing and typesetting industry. Lorem Ipsum has been the industry's standard dummy text ever since the 1500s, when an unknown printer took a galley of type and scrambled it to make a type specimen book. It has survived not only five centuries, but also the leap into electronic typesetting, remaining essentially unchanged. It was popularised in the 1960s with the release of Letraset sheets containing Lorem Ipsum passages, and more recently with desktop publishing software like Aldus PageMaker including versions of Lorem Ipsum.</res:Zalba_na_resenje>
   </res:Obrazlozenje>
   <res:Poverenik>
      <res:Ime property="pred:izdavacIme">Мика</res:Ime>
      <res:Prezime property="pred:izdavacPrezime">Микић</res:Prezime>
   </res:Poverenik>
</res:Resenje>